{
  "$schema": "https://json-schema.org/draft/2020-12/schema",
  "$id": "https://financial-intelligence.local/schemas/import.schema.json",
  "title": "Statement Import",
  "type": "object",
  "additionalProperties": false,
  "required": [
    "schemaVersion", "id", "accountId", "source", "parser", "status", "mapping",
    "counts", "issues", "createdAt", "updatedAt"
  ],
  "properties": {
    "schemaVersion": { "const": "1.0.0" },
    "id": { "$ref": "#/$defs/uuid" },
    "accountId": { "$ref": "#/$defs/uuid" },
    "source": { "$ref": "#/$defs/source" },
    "parser": { "$ref": "#/$defs/parser" },
    "status": { "enum": ["staged", "ready", "committing", "committed", "failed", "cancelled", "deleted"] },
    "mapping": {
      "type": "object",
      "additionalProperties": { "type": ["string", "number", "boolean", "null"] },
      "maxProperties": 60
    },
    "counts": { "$ref": "#/$defs/counts" },
    "issues": {
      "type": "array",
      "maxItems": 10000,
      "items": { "$ref": "#/$defs/issue" }
    },
    "committedRevision": { "type": "integer", "minimum": 1 },
    "createdAt": { "$ref": "#/$defs/dateTime" },
    "updatedAt": { "$ref": "#/$defs/dateTime" },
    "committedAt": { "$ref": "#/$defs/dateTime" }
  },
  "$defs": {
    "uuid": { "type": "string", "format": "uuid" },
    "dateTime": { "type": "string", "format": "date-time" },
    "source": {
      "type": "object",
      "additionalProperties": false,
      "required": ["fileName", "mediaType", "byteSize", "sha256", "retained"],
      "properties": {
        "fileName": { "type": "string", "minLength": 1, "maxLength": 255 },
        "mediaType": { "type": "string", "minLength": 1, "maxLength": 120 },
        "byteSize": { "type": "integer", "minimum": 0 },
        "sha256": { "type": "string", "pattern": "^[0-9a-f]{64}$" },
        "retained": { "type": "boolean" }
      }
    },
    "parser": {
      "type": "object",
      "additionalProperties": false,
      "required": ["id", "version"],
      "properties": {
        "id": { "type": "string", "minLength": 1, "maxLength": 100 },
        "version": { "type": "string", "minLength": 1, "maxLength": 40 }
      }
    },
    "counts": {
      "type": "object",
      "additionalProperties": false,
      "required": ["sourceRows", "valid", "errors", "warnings", "exactDuplicates", "likelyDuplicates", "committed"],
      "properties": {
        "sourceRows": { "type": "integer", "minimum": 0 },
        "valid": { "type": "integer", "minimum": 0 },
        "errors": { "type": "integer", "minimum": 0 },
        "warnings": { "type": "integer", "minimum": 0 },
        "exactDuplicates": { "type": "integer", "minimum": 0 },
        "likelyDuplicates": { "type": "integer", "minimum": 0 },
        "committed": { "type": "integer", "minimum": 0 }
      }
    },
    "issue": {
      "type": "object",
      "additionalProperties": false,
      "required": ["code", "severity", "message"],
      "properties": {
        "code": { "type": "string", "pattern": "^[A-Z][A-Z0-9_]{2,63}$" },
        "severity": { "enum": ["error", "warning", "information"] },
        "sourceLocation": { "type": "string", "maxLength": 160 },
        "field": { "type": "string", "maxLength": 80 },
        "message": { "type": "string", "minLength": 1, "maxLength": 500 }
      }
    }
  }
}
