{
  "schemaVersion": "1.0.0",
  "id": "018f6b80-0d62-7d2c-9a5c-7f5f59cda703",
  "accountId": "018f6b80-0d62-7d2c-9a5c-7f5f59cda702",
  "source": {
    "fileName": "fixture.csv",
    "mediaType": "text/csv",
    "byteSize": 80,
    "sha256": "0000000000000000000000000000000000000000000000000000000000000000",
    "retained": false
  },
  "parser": {
    "id": "financial-intelligence/csv",
    "version": "1.0.0"
  },
  "status": "committed",
  "mapping": {},
  "counts": {
    "sourceRows": 1,
    "valid": 1,
    "errors": 0,
    "warnings": 0,
    "exactDuplicates": 0,
    "likelyDuplicates": 0,
    "committed": 1
  },
  "issues": [],
  "committedRevision": 1,
  "createdAt": "2026-01-02T00:00:00.000Z",
  "updatedAt": "2026-01-02T00:00:00.000Z",
  "committedAt": "2026-01-02T00:00:00.000Z"
}
